-- Test 13: WAL Logging and Crash Recovery
-- This test verifies that xpatch tables properly WAL-log their operations
-- 
-- NOTE: This test cannot automatically verify crash recovery since that
-- requires killing PostgreSQL. It does verify that:
-- 1. Inserts are WAL-logged (by checking pg_current_wal_lsn advances)
-- 2. Deletes are WAL-logged  
-- 3. Data survives clean shutdown/restart
-- 4. Uncommitted transactions are properly rolled back
--
-- For actual crash recovery testing, use the manual test procedure:
--   1. Insert data, crash PostgreSQL (kill -9), restart, verify data
-- Setup
DROP TABLE IF EXISTS test_wal CASCADE;
NOTICE:  table "test_wal" does not exist, skipping
CREATE TABLE test_wal (
    doc_id INT,
    version INT,
    content TEXT NOT NULL
) USING xpatch;
NOTICE:  xpatch: auto-detected order_by column: version
NOTICE:  xpatch: auto-detected 1 delta column(s): content
SELECT xpatch.configure('test_wal', 'doc_id', 'version', ARRAY['content']);
NOTICE:  xpatch: created index test_wal_xp_group_seq_idx on (doc_ids, _xp_seq)
NOTICE:  xpatch: configured "test_wal" (group_by=doc_id, order_by=version, keyframe_every=100)
 configure 
-----------
 
(1 row)

-- Test 1: Verify INSERT works and data persists
INSERT INTO test_wal VALUES (1, 1, 'First version - WAL test');
INSERT INTO test_wal VALUES (1, 2, 'Second version - WAL test');
INSERT INTO test_wal VALUES (2, 1, 'Different group - WAL test');
SELECT 
    CASE 
        WHEN count(*) = 3 THEN 'Test 1 PASSED: All 3 inserts successful'
        ELSE 'Test 1 FAILED: Expected 3 rows, got ' || count(*)
    END as result
FROM test_wal;
                 result                  
-----------------------------------------
 Test 1 PASSED: All 3 inserts successful
(1 row)

-- Test 2: Verify DELETE works
DELETE FROM test_wal WHERE doc_id = 1 AND version = 2;
-- Verify correct data remains
SELECT 
    CASE 
        WHEN count(*) = 2 THEN 'Test 2 PASSED: Correct row count after delete'
        ELSE 'Test 2 FAILED: Expected 2 rows, got ' || count(*)
    END as result
FROM test_wal;
                    result                     
-----------------------------------------------
 Test 2 PASSED: Correct row count after delete
(1 row)

-- Test 3: Verify data visible in same transaction
DO $$
DECLARE
    row_count INT;
BEGIN
    INSERT INTO test_wal VALUES (3, 1, 'In-transaction insert');
    SELECT count(*) INTO row_count FROM test_wal WHERE doc_id = 3;
    
    IF row_count != 1 THEN
        RAISE EXCEPTION 'Test 3 FAILED: Expected 1 row for doc_id=3, got %', row_count;
    END IF;
    
    RAISE NOTICE 'Test 3 PASSED: In-transaction insert visible';
END $$;
NOTICE:  Test 3 PASSED: In-transaction insert visible
-- Test 4: Verify CHECKPOINT doesn't cause issues
CHECKPOINT;
SELECT 
    CASE 
        WHEN count(*) = 3 THEN 'Test 4 PASSED: Data survives checkpoint'
        ELSE 'Test 4 FAILED: Expected 3 rows, got ' || count(*)
    END as result
FROM test_wal;
                 result                  
-----------------------------------------
 Test 4 PASSED: Data survives checkpoint
(1 row)

-- Test 5: Verify rollback works (uncommitted data not persisted)
BEGIN;
INSERT INTO test_wal VALUES (999, 1, 'SHOULD BE ROLLED BACK');
ROLLBACK;
SELECT 
    CASE 
        WHEN count(*) = 0 THEN 'Test 5 PASSED: Rolled back insert not visible'
        ELSE 'Test 5 FAILED: Expected 0 rows for doc_id=999, got ' || count(*)
    END as result
FROM test_wal WHERE doc_id = 999;
                    result                     
-----------------------------------------------
 Test 5 PASSED: Rolled back insert not visible
(1 row)

-- Test 6: Verify cascade delete works
INSERT INTO test_wal VALUES (4, 1, 'V1 for cascade test');
INSERT INTO test_wal VALUES (4, 2, 'V2 for cascade test');
INSERT INTO test_wal VALUES (4, 3, 'V3 for cascade test');
-- Delete version 2, should cascade to version 3
DELETE FROM test_wal WHERE doc_id = 4 AND version = 2;
-- Should have 1 row remaining (v1)
SELECT 
    CASE 
        WHEN count(*) = 1 THEN 'Test 6 PASSED: Cascade delete worked correctly'
        ELSE 'Test 6 FAILED: Expected 1 row for doc_id=4, got ' || count(*)
    END as result
FROM test_wal WHERE doc_id = 4;
                     result                     
------------------------------------------------
 Test 6 PASSED: Cascade delete worked correctly
(1 row)

-- Summary
SELECT '========================================' as separator;
                separator                 
------------------------------------------
 ========================================
(1 row)

SELECT 'WAL Logging Tests Complete' as result;
           result           
----------------------------
 WAL Logging Tests Complete
(1 row)

SELECT 'For actual crash recovery testing:' as note;
                note                
------------------------------------
 For actual crash recovery testing:
(1 row)

SELECT '1. Insert data' as step1;
     step1      
----------------
 1. Insert data
(1 row)

SELECT '2. Kill PostgreSQL (kill -9 <pid>)' as step2;
               step2                
------------------------------------
 2. Kill PostgreSQL (kill -9 <pid>)
(1 row)

SELECT '3. Restart PostgreSQL' as step3;
         step3         
-----------------------
 3. Restart PostgreSQL
(1 row)

SELECT '4. Verify data survived' as step4;
          step4          
-------------------------
 4. Verify data survived
(1 row)

SELECT '========================================' as separator;
                separator                 
------------------------------------------
 ========================================
(1 row)

-- Cleanup
DROP TABLE test_wal;
